Our ID,Our Item Type,Item Type,Publication Year,Author,Title,Publication Title,ISSN,DOI,URL,Abstract Note,Date,Pages,Num Pages,Issue,Volume,Publisher,Place,Language,Type,Our Sorting Date,Our Note
132,includedItem,journalArticle,2006,"Koster, Annemarie;Bosma, Hans;Kempen, Gertrudis I. J. M.;Penninx, Brenda W. J. H.;Beekman, Aartjan T. F.;Deeg, Dorly J. H.;van Eijk, Jacques Th. M.","Socioeconomic differences in incident depression in older adults: The role of psychosocial factors, physical health status, and behavioral factors",Journal of Psychosomatic Research,0022-3999,10.1016/j.jpsychores.2006.05.009,https://www.sciencedirect.com/science/article/pii/S0022399906002716,"Objective The objective of this study was to examine the association between socioeconomic status (SES) and the onset of depression in older adults and to determine the relative contribution of psychosocial factors, physical health status, and behavioral factors in explaining this link. Methods Data were from 2593 men and women, aged 55–85 years, participating in the Longitudinal Aging Study Amsterdam. Two indicators of SES were used: education and income. The onset of depression was measured over 9 years of follow-up. Results Adjusted hazard ratios of incident depression were significantly higher in those with low education and low income. Psychosocial factors explained on average 16% of the SES differences in incident depression, physical health status on average 7%, and behavioral factors less than 5%. Conclusion In older adults, low SES predicted the incidence of depression. Part of this association was explained by psychosocial factors and physical health status.",11/1/2006,619-627,,5,61,,,en,,11/1/2006,
133,includedItem,journalArticle,2006,"Sims, Jane;Hill, Keith;Davidson, Sandra;Gunn, Jane;Huang, Nancy",Exploring the feasibility of a community-based strength training program for older people with depressive symptoms and its impact on depressive symptoms,BMC Geriatrics,1471-2318,10.1186/1471-2318-6-18,https://doi.org/10.1186/1471-2318-6-18,"Depression is a disabling, prevalent condition. Physical activity programs may assist depression management in older people, ameliorate co-morbid conditions and reduce the need for antidepressants. The UPLIFT pilot study assessed the feasibility of older depressed people attending a community-based progressive resistance training (PRT) program. The study also aimed to determine whether PRT improves depressive status in older depressed patients.",11/30/2006,18,,1,6,,,,,11/30/2006,
134,includedItem,journalArticle,2006,"Lau, Wing Chung;Yu, C. W.;Lee, Antoinette;Sung, Rita Y. T.",The physiological and psychological effects of resistance training on Chinese obese adolescents,Journal of Exercise Science and Fitness,,,http://www.fmshk.org/journal/hkjsmss/v17/paper7.pdf,,12/1/2006,115-120,,2,2,,,,,12/1/2006,
135,includedItem,journalArticle,2007,"Clark, Charlotte;Haines, Mary M.;Head, Jenny;Klineberg, Emily;Arephin, Muna;Viner, Russell;Taylor, Stephanie J. C.;Booy, Robert;Bhui, Kam;Stansfeld, Stephen A.",Psychological symptoms and physical health and health behaviours in adolescents: a prospective 2-year study in East London,Addiction,"09652140, 13600443",10.1111/j.1360-0443.2006.01621.x,http://doi.wiley.com/10.1111/j.1360-0443.2006.01621.x,"Aims To examine whether physical health and health-risk behaviours in young people are risk factors for psychological distress and depressive symptoms over a 2-year period. Design/setting A 2-year, prospective epidemiological cohort study in East London. Participants A total of 1615 adolescents from the Research with East London Adolescents: Community Health Survey (RELACHS)—a representative cohort of young people aged 11–12 and 13–14 years at baseline, followed-up after 2 years. Measurements Psychological distress and depressive symptoms identiﬁed by the self-report Strengths and Difﬁculties Questionnaire and the Short Moods and Feelings Questionnaire at baseline and follow-up. Data on overweight/obesity, general health, long-standing illness, physical activity, smoking, alcohol use and drug use were collected from questionnaires completed by the adolescents at baseline and follow-up. Findings At follow-up, 10.1% of males and 12.9% of females reported psychological distress; 20% of males and 33.7% of females reported depressive symptoms. Having tried drugs or engaged in two or more health-risk behaviours (smoking, alcohol use or drug use) at baseline predicted psychological distress and depressive symptoms at follow-up. Smoking on its own, long-standing illness, obesity/overweight and activity levels were not associated with later psychological health. Risk of poor psychological health at follow-up was associated strongly with psychological health at baseline. Conclusions Psychological health at baseline was the strongest predictor of psychological health at follow-up. Engaging in two or more health-risk behaviours moderately increased the risk of poor psychological health, suggesting that prevention strategies targeting co-occuring substance use may reduce burden of disease.",2007-01,126-135,,1,102,,,en,,1/1/2007,
136,includedItem,journalArticle,2007,"Knubben, K;Reischies, F M;Adli, M;Schlattmann, P;Bauer, M;Dimeo, F","A randomised, controlled study on the effects of a short-term endurance training programme in patients with major depression",British journal of sports medicine,1473-0480,10.1136/bjsm.2006.030130,http://www.library.illinois.edu/proxy/go.php?url=http://search.ebscohost.com/login.aspx?direct=true&db=cmedm&AN=17062659&site=eds-live&scope=site,"Objective: To evaluate the short-term effects of exercise in patients with major depression.; Design: Prospective, randomised, controlled study.; Setting: A university hospital.; Patients: A consecutive series of 38 inpatients with a major depression episode undergoing standard clinical antidepressant drug treatment.; Interventions: Patients were randomly assigned to an exercise (walking, n = 20) or placebo (low-intensity stretching and relaxation exercises, n = 18) group. Training was carried out for 10 days.; Main Outcome Measurements: Severity of depression assessed with the Bech-Rafaelsen Melancholy Scale (BRMS) and the Center for Epidemiologic Studies Depression scale (CES-D).; Results: After 10 days, reduction of depression scores in the exercise group was significantly larger than in the placebo group (BRMS: 36% v 18%; CES-D: 41% v 21%; p for both = 0.01); the proportion of patients with a clinical response (reduction in the BRMS scores by more than six points) was also larger for the exercise group (65% v 22%, p<0.01).; Conclusions: Endurance exercise may help to achieve substantial improvement in the mood of selected patients with major depression in a short time.",2007-01,29-33,,1,41,,,,,1/1/2007,
137,includedItem,journalArticle,2007,"Krogh, Jesper;Petersen, Lone;Timmermann, Michael;Saltin, Bengt;Nordentoft, Merete","Design paper: The DEMO trial: A randomized, parallel-group, observer-blinded clinical trial of aerobic versus non-aerobic versus relaxation training for patients with light to moderate depression",Contemporary Clinical Trials,1551-7144,10.1016/j.cct.2006.07.001,http://www.sciencedirect.com/science/article/pii/S1551714406000917,"Background In western countries, the yearly incidence of depression is estimated to be 3–5% and the lifetime prevalence is 17%. In patient populations with chronic diseases the point prevalence may be 20%. Depression is associated with increased risk for various conditions such as osteoporoses, cardiovascular diseases, and dementia. WHO stated in 2000 that depression was the fourth leading cause of disease burden in terms of disability. In 2000 the cost of depression in the US was estimated to 83 billion dollars. A predominance of trials suggests that physical exercise has a positive effect on depressive symptoms. However, a meta-analysis from 2001 stated: “The effectiveness of exercise in reducing symptoms of depression cannot be determined because of a lack of good quality research on clinical populations with adequate follow-up.” Objectives The major objective for this randomized trial is to compare the effect of non-aerobic, aerobic, and relaxation training on depressive symptoms using the blindly assessed Hamilton depression scale (HAM-D17) as primary outcome. The secondary outcome is the effect of the intervention on working status (i.e., lost days from work, employed/unemployed) and the tertiary outcomes consist of biological responses. Design The trial is designed as a randomized, parallel-group, observer-blinded clinical trial. Patients are recruited through general practitioners and psychiatrist and randomized to three different interventions: 1) non-aerobic, — progressive resistance training, 2) aerobic training, — cardio respiratory fitness, and 3) relaxation training with minimal impact on strength or cardio respiratory fitness. Training for all three groups takes place twice a week for 4 months. Evaluation of patients' symptoms takes place four and 12 months after inclusion. The trial is designed to include 45 patients in each group. Statistical analysis will be done as intention to treat (all randomized patients). Results from the DEMO trial will be reported according to the CONSORT guidelines in 2008–2009.",1/1/2007,79-89,,1,28,,,en,,1/1/2007,
138,includedItem,journalArticle,2007,"Vieira, José Luiz Lopes;Porcu, Mauro;Rocha, Priscila Garcia Marques da",[The regular physical exercise’s practice as complementary therapy to the treatment of depressed women] A prática de exercícios físicos regulares como terapia complementar ao tratamento de mulheres com depressão,Jornal Brasileiro de Psiquiatria,0047-2085,10.1590/S0047-20852007000100007,http://www.scielo.br/scielo.php?script=sci_abstract&pid=S0047-20852007000100007&lng=pt&nrm=iso&tlng=pt,,2007-01,23-28,,1,56,,,pt,,1/1/2007,
139,includedItem,journalArticle,2007,"Baker, Michael K.;Kennedy, David J.;Bohle, Philip L.;Campbell, Deena S.;Knapman, Leona;Grady, Jodie;Wiltshire, James;McNamara, Maria;Evans, William J.;Atlantis, Evan;Singh, Maria A. Fiatarone","Efficacy and feasibility of a novel tri-modal robust exercise prescription in a retirement community: a randomized, controlled trial",Journal of the American Geriatrics Society,28614,10.1111/j.1532-5415.2006.01031.x,http://www.library.illinois.edu/proxy/go.php?url=http://search.ebscohost.com/login.aspx?direct=true&db=edb&AN=23573583&site=eds-live&scope=site,"OBJECTIVES: To test the feasibility and efficacy of current guidelines for multimodal exercise programs in older adults. DESIGN: Randomized, controlled trial. SETTING: Retirement village. PARTICIPANTS: Thirty-eight subjects (14 men and 24 women) aged 76.6 ± 6.1. INTERVENTION: A wait list control or 10 weeks of supervised exercise consisting of high-intensity (80% of one-repetition maximum (1RM)) progressive resistance training (PRT) 3 days per week, moderate-intensity (rating of perceived exertion 11 to 14/20) aerobic training 2 days per week, and progressive balance training 1 day per week. MEASUREMENTS: Blinded assessments of dynamic muscle strength (1RM), balance, 6-minute walk, gait velocity, chair stand, stair climb, depressive symptoms, self-efficacy, and habitual physical activity level. RESULTS: Higher baseline strength and psychological well-being were associated with better functional performance. Strength gains over 10 weeks averaged 39±31% in exercise, versus 21±24% in controls ( P=.10), with greater improvements in hip flexion ( P=.01), hip abduction ( P=.02), and chest press ( P=.04) in the exercise group. Strength adaptations were greatest in exercises in which the intended continuous progressive overload was achieved. Stair climb power (12.3±15%, P=.002) and chair stand time (−7.1±15%, P=.006) improved significantly and similarly in both groups. Reduction in depressive symptoms was significantly related to compliance (attendance rate r=−0.568, P=.009, PRT progression in loading r=−0.587, P=.02, and total volume of aerobic training r=−0.541, P=.01), as well as improvements in muscle strength ( r=−0.498, P=.002). CONCLUSION: Robust physical and psychological adaptations to exercise are linked, although volumes and intensities of multiple exercise modalities sufficient to cause significant adaptation appear difficult to prescribe and adhere to simultaneously in older adults.",1/16/2007,10-Jan,,1,55,,,,,1/16/2007,
140,includedItem,journalArticle,2007,"Brenes, G. A.;Williamson, J. D.;Messier, S. P.;Rejeski, W. J.;Pahor, M.;Ip, E.;Penninx, B. W. J. H.",Treatment of minor depression in older adults: A pilot study comparing sertraline and exercise,Aging & Mental Health,"1360-7863, 1364-6915",10.1080/13607860600736372,http://www.tandfonline.com/doi/abs/10.1080/13607860600736372,"The purpose of this study was to conduct a pilot clinical trial to test the feasibility and efficacy of an exercise program and anti-depressant treatment compared with usual care in improving the emotional and physical functioning of older adults with minor depression. Participants were 37 older adults with minor depression who were randomized to exercise, sertraline, or usual care; 32 participants completed the 16-week study. Outcomes included measures of both emotional (clinician and self-report) and physical (observed and self-report) functioning. There were trends for the superiority of the exercise and sertraline conditions over usual care in improving SF-36 mental health scores and clinician-rated depression scores. Individuals in the exercise condition showed greater improvements in physical functioning than individuals in the usual care condition. Both sertraline and exercise show promise as treatments for late-life minor depression. However, exercise has the added benefit of improving physical functioning as well.",1/18/2007,61-68,,1,11,,,en,,1/18/2007,
141,includedItem,journalArticle,2007,"Krishnamurthy, Manjunath Nandi;Telles, Shirley",Assessing depression following two ancient Indian interventions: effects of yoga and ayurveda on older adults in a residential home,Journal of Gerontological Nursing,0098-9134,10.3928/00989134-20070201-05,,"The effects of yoga and ayurveda on geriatric depression were evaluated in 69 persons older than 60 who were living in a residential home. Participants were stratified by age and gender and randomly allocated to three groups: Yoga, Ayurveda, or Wait-list Control. The 15-item Geriatric Depression Scale was used to assess depressive symptoms prior to the intervention, and after 3 months and 6 months post-intervention. Participation in one of the three groups lasted 24 weeks. The yoga program (7 hours 30 minutes per week) included physical postures, relaxation techniques, regulated breathing, devotional songs, and lectures. The Ayurveda Group received an herbal preparation twice daily for the whole period. The depression symptom scores of the Yoga Group at both 3 and 6 months decreased significantly, from a group average baseline of 10.6 to 8.1 and 6.7, respectively (p < .001, paired t-test). The other groups showed no change. Hence, an integrated approach of yoga including the mental and philosophical aspects in addition to the physical practices was useful for institutionalized older persons.",2007-02,17-23,,2,33,,,en,,2/1/2007,
142,includedItem,journalArticle,2007,"Rolland, Yves;Pillard, Fabien;Klapouszczak, Adrian;Reynish, Emma;Thomas, David;Andrieu, Sandrine;Rivière, Daniel;Vellas, Bruno","Exercise program for nursing home residents with Alzheimer's disease: a 1-year randomized, controlled trial",Journal of the American Geriatrics Society,1532-5415,10.1111/j.1532-5415.2007.01035.x,http://agsjournals.onlinelibrary.wiley.com/doi/abs/10.1111/j.1532-5415.2007.01035.x,"OBJECTIVES: To investigate the effectiveness of an exercise program in improving ability to perform activities of daily living (ADLs), physical performance, and nutritional status and decreasing behavioral disturbance and depression in patients with Alzheimer's disease (AD). DESIGN: Randomized, controlled trial. SETTING: Five nursing homes. PARTICIPANTS: One hundred thirty-four ambulatory patients with mild to severe AD. INTERVENTION: Collective exercise program (1 hour, twice weekly of walk, strength, balance, and flexibility training) or routine medical care for 12 months. MEASUREMENTS: ADLs were assessed using the Katz Index of ADLs. Physical performance was evaluated using 6-meter walking speed, the get-up-and-go test, and the one-leg-balance test. Behavioral disturbance, depression, and nutritional status were evaluated using the Neuropsychiatric Inventory, the Montgomery and Asberg Depression Rating Scale, and the Mini-Nutritional Assessment. For each outcome measure, the mean change from baseline to 12 months was calculated using intention-to-treat analysis. RESULTS: ADL mean change from baseline score for exercise program patients showed a slower decline than in patients receiving routine medical care (12-month mean treatment differences: ADL=0.39, P=.02). A significant difference between the groups in favor of the exercise program was observed for 6-meter walking speed at 12 months. No effect was observed for behavioral disturbance, depression, or nutritional assessment scores. In the intervention group, adherence to the program sessions in exploratory analysis predicted change in ability to perform ADLs. No adverse effects of exercise occurred. CONCLUSION: A simple exercise program, 1 hour twice a week, led to significantly slower decline in ADL score in patients with AD living in a nursing home than routine medical care.",2007-02,158-165,,2,55,,,en,,2/1/2007,
143,includedItem,journalArticle,2007,"van der Kooi, E. L.;Kalkman, J. S.;Lindeman, E.;Hendriks, J. C. M.;van Engelen, B. G. M.;Bleijenberg, G.;Padberg, G. W.",Effects of training and albuterol on painand fatigue in facioscapulohumeral muscular dystrophy,Journal of Neurology,1432-1459,10.1007/s00415-006-0432-4,https://doi.org/10.1007/s00415-006-0432-4,"We recentlyreported a randomisedcontrolled trial on the efficacy ofstrength training and the β 2-adrenergic agonist albuterol inpatients with facioscapulohumeralmuscular dystrophy (FSHD).Strength training and albuterolappeared safe interventions withlimited positive effect on musclestrength and volume. We concurrentlyexplored the prevalence andthe characteristics of pain andfatigue in the participating FSHDpatients, because these are probablyunderreported but clinicallyrelevant symptoms in this disorder.Next, we studied the effects ofalbuterol and strength training onpain, experienced fatigue, healthrelatedfunctional status and psychologicaldistress.",3/14/2007,931-940,,7,254,,,en,,3/14/2007,
144,includedItem,journalArticle,2007,"Lin, Mau-Roung;Wolf, Steven L.;Hwang, Hei-Fen;Gong, Sheng-You;Chen, Chih-Yi","A randomized, controlled trial of fall prevention programs and quality of life in older fallers",Journal of the American Geriatrics Society,1532-5415,10.1111/j.1532-5415.2007.01146.x,https://agsjournals.onlinelibrary.wiley.com/doi/abs/10.1111/j.1532-5415.2007.01146.x,"OBJECTIVES: To compare the effects of three fall-prevention programs (education (ED), home safety assessment and modification (HSAM), and exercise training (ET)) on quality of life (QOL), functional balance and gait, activities of daily living (ADLs), fear of falling, and depression in adults aged 65 and older. DESIGN: A 4-month randomized trial. SETTING: Randomized, controlled trial. PARTICIPANTS: One hundred fifty participants who had experienced a recent fall. MEASUREMENTS: QOL was assessed according to the brief version of the World Health Organization Quality of Life instrument (WHOQOL-BREF), functional balance and gait according to functional reach and Tinetti balance and gait, ADLs according to the Older Americans Resources and Services questionnaire, fear of falling according to a visual analog scale, and depression level according to the Geriatric Depression Scale. RESULTS: The score changes for the ET group were 2.1 points greater on the physical domain (95% confidence interval (CI)=−1.2–5.3), 3.8 points greater on the psychological domain (95% CI=0.7–7.0), and for the WHOQOL-BREF, 3.4 points greater on the social domain (95% CI=0.7–6.1) and 3.2 points greater on the environmental domain (95% CI=0.6–5.7) than for the ED group. The score change for each domain of the WHOQOL-BREF for the HSAM group was greater than that for the ED group, although these results were not statistically significant. The ET group also had greater improvements in functional reach, Tinetti balance and gait, and fear of falling than the ED group. CONCLUSION: The QOL outcome supports the superiority of ET over the other two interventions in older people who have recently fallen. This finding also parallels those gathered from the functional measures.",2007-04,499-506,,4,55,,,en,,4/1/2007,
145,includedItem,journalArticle,2007,"Fransen, Marlene;Nairn, Lillias;Winstanley, Julie;Lam, Paul;Edmonds, John",Physical activity for osteoarthritis management: A randomized controlled clinical trial evaluating hydrotherapy or Tai Chi classes,Arthritis Care & Research,1529-0131,10.1002/art.22621,,"Objective To determine whether Tai Chi or hydrotherapy classes for individuals with chronic symptomatic hip or knee osteoarthritis (OA) result in measurable clinical benefits. Methods A randomized controlled trial was conducted among 152 older persons with chronic symptomatic hip or knee OA. Participants were randomly allocated for 12 weeks to hydrotherapy classes (n = 55), Tai Chi classes (n = 56), or a waiting list control group (n = 41). Outcomes were assessed 12 and 24 weeks after randomization and included pain and physical function (Western Ontario and McMaster Universities Osteoarthritis Index), general health status (Medical Outcomes Study Short Form 12 Health Survey [SF-12], version 2), psychological well-being, and physical performance (Up and Go test, 50-foot walk time, timed stair climb). Results At 12 weeks, compared with controls, participants allocated to hydrotherapy classes demonstrated mean improvements (95% confidence interval) of 6.5 (0.4, 12.7) and 10.5 (3.6, 14.5) for pain and physical function scores (range 0–100), respectively, whereas participants allocated to Tai Chi classes demonstrated improvements of 5.2 (−0.8, 11.1) and 9.7 (2.8, 16.7), respectively. Both class allocations achieved significant improvements in the SF-12 physical component summary score, but only allocation to hydrotherapy achieved significant improvements in the physical performance measures. All significant improvements were sustained at 24 weeks. In this almost exclusively white sample, class attendance was higher for hydrotherapy, with 81% attending at least half of the available 24 classes, compared with 61% for Tai Chi. Conclusion Access to either hydrotherapy or Tai Chi classes can provide large and sustained improvements in physical function for many older, sedentary individuals with chronic hip or knee OA.",4/15/2007,407-414,,3,57,,,en,,4/15/2007,
146,includedItem,journalArticle,2007,"van Gool, Coen H.;Kempen, Gertrudis I.J.M.;Bosma, Hans;van Boxtel, Martin P.J.;Jolles, Jelle;van Eijk, Jacques T.M.",Associations between lifestyle and depressed mood: longitudinal results from the Maastricht Aging Study,American Journal of Public Health,"0090-0036, 1541-0048",10.2105/AJPH.2004.053199,http://ajph.aphapublications.org/doi/10.2105/AJPH.2004.053199,"Objectives. We examined whether healthy lifestyles are associated with absence of depressed mood. A//ef/7ods. A sample of 1169 adult participants in the Maastricht Aging Study provided baseline and 6-year follow-up data on smoking, alcohol use, physical exercise, body mass index, and mood. We examined associations between lifestyles and depressed mood using longitudinal analyses controlling for baseline depressive symptoms and covariates. Results. Reports of excessive alcohol use at baseline predicted depressed mood at follow-up (relative risk [RR] = 2.48; 95% confidence interval [CI] = 1.08, 5.69), and reports of more than 30 minutes of physical exercise per day at baseline were associated with an absence of depressed mood at follow-up (RR = 0.52; 95% 01=0.29,0.92). Reports of being engaged in physical exercise throughout the 6-year follow-up period were also associated with absence of depressed mood (RR = 0.56; 95% Cl = 0.34, 0.93). Conclusions. In this relatively healthy population sample, certain lifestyles either predicted or protected against depressed mood. Adopting or maintaining healthy lifestyles might be a starting point in preventing or treating depressed mood over time. {Am J Public Health. 2006;96:887-894. doi:10.2105/AJPH.2004.053199)",2007-05,887-894,,5,97,,,en,,5/1/2007,
