Our ID,Our Item Type,Item Type,Publication Year,Author,Title,Publication Title,ISSN,DOI,URL,Abstract Note,Date,Pages,Num Pages,Issue,Volume,Publisher,Place,Language,Type,Our Sorting Date,Our Note
331,includedItem,journalArticle,2015,"Schuch, F. B.;Vasconcelos-Moreno, M. P.;Borowsky, C.;Zimmermann, A. B.;Rocha, N. S.;Fleck, M. P.",Exercise and severe major depression: effect on symptom severity and quality of life at discharge in an inpatient cohort,Journal of Psychiatric Research,1879-1379,10.1016/j.jpsychires.2014.11.005,,"BACKGROUND: Exercise is a potential treatment for depression. However, few studies have evaluated the role of adjunct exercise in the treatment of severely major depressed inpatients. The goal of this study was to evaluate the effects of add-on exercise on the usual treatment of severely depressed inpatients. METHODS: Fifty participants were randomized to an exercise (exercise + usual treatment) or a control (usual treatment) group. Twenty-five patients were randomly allocated to each group. The participants in the exercise group performed three sessions per week throughout the hospitalization period, with a goal dose of 16.5 kcal/kg/week plus the usual pharmacological treatment. Depressive symptoms and the Quality of Life (QoL) of the participants were assessed at the baseline, the second week, and discharge. RESULTS: A significant group × time interaction was found for depressive symptoms and the physical and psychological domains of QoL. Differences between groups occurred at the second week and discharge with respect to depressive symptoms and the physical and psychological domains of QoL. There was no difference in the remission rate at discharge (48% and 32% for the exercise and control group, respectively). An NNT of 6.25 was found. No significant baseline characteristics predict remission at discharge. CONCLUSION: Add-on exercise is an efficacious treatment for severely depressed inpatients, improving their depressive symptoms and QoL. Initial acceptance of exercise remains a challenge.",2015-02,25-32,,,61,,,en,,2/1/2015,
332,includedItem,journalArticle,2015,"Shi, Guifeng",[The role of setting - up exercise on rehabilitation in patients with depressive episode],[China Journal of Health Psychology] 中国健康心理学杂志,1005-1252,10.13342/j.cnki.cjhp.2015.02.009,,目的：探讨健身操对抑郁发作患者康复的影响。方法：对70例住院抑郁发作患者在药物治疗的同时，随机分为研究组35例辅以健身操训练8周，采用汉密尔顿抑郁量表（ HAMD－24）于入组第一天、4周、8周进行评定，护士用住院精神病人观察量表（ NOSIE－30）于入组前后进行评定，并与单纯药物治疗的35例抑郁发作患者进行对照。结果：经8周健身操训练后，研究组汉密尔顿抑郁量表总分明显低于对照组，差异有极显著性（ t＝－5．761， P＜0．01），研究组治愈率达88．57％，对照组治愈率62．85％（χ2＝6．293，P＜0．05），护士用住院病人观察量表研究组总积极因子分、病情总估计明显高于对照组，总消极因子分明显低于对照组，差异有极显著性（P均＜0．01）．结论：健身操训练能明显改善抑郁发作患者的抑郁情绪，提高疗效，较单用抗抑郁剂治疗效果更显著。,2015-02,"184-186,187",,2,23,,,zh,,2/1/2015,
333,includedItem,journalArticle,2015,"Da Ronch, C.;Canuto, A.;Volkert, J.;Massarenti, S.;Weber, K.;Dehoust, M.C.;Nanni, M.G.;Andreas, S.;Sehner, S.;Schulz, H.;Härter, M.;Grassi, L.","Association of television viewing with mental health and mild cognitive impairment in the elderly in three European countries, data from the MentDis_ICF65+ project",Mental Health and Physical Activity,17552966,10.1016/j.mhpa.2014.11.002,https://linkinghub.elsevier.com/retrieve/pii/S1755296614000581,"Background: Time spent watching TV by Europeans has been calculated to be 22.1 h per week on average and it has shown to be correlated with a series of physical and mental problems in adults. Very little research is available in population over 65. This study aimed at evaluating the association between TV viewing and mental disorders and cognitive performance, taking into account the general physical activity level and socio-demographic characteristics in Europe. Methods: Within the MentDis_ICF65þ study, a subsample of 1383 subjects aged 65e84 years were assessed by the Composite International Diagnostic Interview (CIDI65þ) and the International Physical Activity Questionnaire (IPAQ) for physical activity evaluation. Time spent in watching TV was assessed through a self report instrument. Results: Forty-three per cent of the total sample watched TV for 5e7 days a week for 2 or more hours every day. Females, people who lived alone, older subjects and those with lower education signiﬁcantly watched TV for a longer time. Stepwise multiple regression showed statistically signiﬁcant inverse correlation between Mini-Mental State Examination scores and TV viewing time (p < 0.001). Apart from a negative association with Major Depressive Disorder, no particular associations were found between TV viewing and psychopathological diagnoses. Conclusions: Given the relationship of time spending watching TV with cognitive impairment, awareness should be raised about the possible negative effects of TV viewing on the elderly and programs to reduce TV viewing time should be set up.",2015-03,14-Aug,,,8,,,en,,3/1/2015,
334,includedItem,journalArticle,2015,"Soundy, A. ( 1 );Roskell, C. ( 1 );Stubbs, B. ( 2 );Probst, M. ( 3,4 );Vancampfort, D. ( 3,4 )",Investigating the benefits of sport participation for individuals with schizophrenia: A systematic review,Psychiatria Danubina,3535053,,http://www.library.illinois.edu/proxy/go.php?url=http://search.ebscohost.com/login.aspx?direct=true&db=edselc&AN=edselc.2-52.0-84924230356&site=eds-live&scope=site,,2015-03,13-Feb,,1,27,,,en,,3/1/2015,
335,includedItem,journalArticle,2015,"Sun, Yunqiao",[Effects of Baduanjin combined with relaxation exercise on community type 2 diabetics with dysthymic disorder] 八段锦结合放松功对社区2型糖尿病伴情绪障碍患者作用的研究,[Chinese Rural Health Service Administration] 中国农村卫生事业管理,1005-5916,,,"目的:探讨八段锦结合放松功对社区2型糖尿病伴情绪障碍患者的影响.方法:选取2012年3月-2013年10月某社区已建卡管理的糖尿病患者65例,随机分为观察组33例及对照组32例.对两组治疗前后的抑郁自评量表(SDS)和焦虑自评量表(SAS)进行评分,同时检测空腹血糖、餐后2h血糖、糖化血红蛋白含量在干预前后的变化进行比较.结果:两组干预后与干预前SAS分值比较,差异均有统计学意义(P＜0.05);研究组干预后的SAS分值明显低于对照组,两组比较,差异显著(P＜0.05).两组干预后与干预前SDS分值比较,差异均有统计学意义(P＜0.05);研究组干预后的SDS分值明显低于对照组,两组比较,差异显著(P＜0.05).两组患者治疗前后糖代谢指标比较,差异有统计学意义(P＜0.05);观察组干预6个月后,其FPG、2hPG及HbA1C皆明显低于对照组,两组比较差异有统计学意义(P＜0.05).结论:八段锦结合放松功对社区2型糖尿病伴抑郁或焦虑患者心理生理都有一定程度的改善.",2015-03,357-359,,3,35,,,zh,,3/1/2015,
336,includedItem,journalArticle,2015,"Wielopolski, Jan;Reich, Karin;Clepce, Marion;Fischer, Marie;Sperling, Wolfgang;Kornhuber, Johannes;Thuerauf, Norbert",Physical activity and energy expenditure during depressive episodes of major depression,Journal of Affective Disorders,1650327,10.1016/j.jad.2014.11.060,https://linkinghub.elsevier.com/retrieve/pii/S0165032714007848,"Background: Recent data suggest a substantial association between physical activity and depressive symptoms, but there is a lack of research evaluating the physical activity levels in patients suffering from unipolar depression across different stages of disease in an objective way. The aim of the present pilot study was to objectively examine physical activity levels of this patient group compared to healthy controls. Methods: Physical activity performance of 19 patients with major depressive episode and 19 healthy controls was assessed at three different time points using a multisensory armband device (SenseWears Pro3 Armband) and was reported as total energy expenditure (TEE), active energy expenditure (EE), metabolic equivalents (METs), physical activity (PA) and time of lying down (LD), in each case over 24 h. Results: Over all measurements, depressive patients presented a signiﬁcantly lower mean TEE and EE over 24 h. Moreover, the patient group showed signiﬁcantly shorter duration of PA and lower average MET over 24 h. When depressive symptoms abated, physical activity parameters signiﬁcantly increased in the patient group. Correlation analyses demonstrated a signiﬁcant relation between depressive status/anhedonia and parameters of physical activity, especially in healthy subjects. Limitations: Results represented valid data for inpatients only. Conclusion: Acute unipolar depression was associated with a signiﬁcantly lower level of physical activity and showed a signiﬁcant increase in parallel to clinical improvement. Electronic monitoring of physical activity may be an additional tool for evaluating and controlling therapeutic effects.",2015-03,310-316,,,174,,,en,,3/1/2015,
337,includedItem,journalArticle,2015,"Choi, Young;Park, Eun-Cheol;Kim, Jae-Hyun;Yoo, Ki-Bong;Choi, Jae-Woo;Lee, Kwang-Sig",A change in social activity and depression among Koreans aged 45 years and more: analysis of the Korean Longitudinal Study of Aging (2006–2010),International Psychogeriatrics,"1041-6102, 1741-203X",10.1017/S1041610214002439,http://www.cambridge.org/core/journals/international-psychogeriatrics/article/change-in-social-activity-and-depression-among-koreans-aged-45-years-and-more-analysis-of-the-korean-longitudinal-study-of-aging-20062010/85DD543AE517E70D7A036A9AD2652116,"Background:                The aim of this study is to examine a relationship between a change in social activity and depression among Koreans aged 45 years or more.                                          Methods:                Data came from the Korean Longitudinal Study of Aging (KLoSA) (2006–2010), with 5,327 participants aged 45 years or more. The generalized estimating equation (GEE) with the logit link was used to investigate an association between a change in social activity during 2006–2008 (or 2008–2010) and depression among respondents in year 2008 (or Y2010). Depression was measured by Center for Epidemiological Studies Depression scale (CES-D10) and a change in social activity was classified with four categories, i.e. “consistent participation”, “consistent non-participation”, “participation to non-participation”, and “non-participation to participation”. Social activity was divided into various elements and the same analysis was conducted for each of these elements.                                          Results:                Those with consistent non-participation and from participation to non-participation were more likely to be depressed than those with consistent participation and from non-participation to participation in social activities (OR 1.44 [95% CI 1.22–1.71], OR 1.35 [95% CI 1.15–1.58] vs. OR 1.00 [Reference], OR 1.27 [95% CI 1.09–1.48]). In addition, the strength of the negative association between consistent or new participation in social activity and depression was different across different elements of social activity. The negative association was particularly strong for leisure, culture or sports clubs, and for family or school reunion.                                          Conclusion:                For improving the mental health of the population aged 45 years or more, the promotion of their continued or new participations in leisure/culture clubs and family/school reunion might be needed in South Korea.",2015-04,629-637,,4,27,,,en,,4/1/2015,
338,includedItem,journalArticle,2015,"Hiles, Sarah A.;Baker, Amanda L.;de Malmanche, Theo;McEvoy, Mark;Boyle, Michael;Attia, John",Unhealthy lifestyle may increase later depression via inflammation in older women but not men,Journal of Psychiatric Research,223956,10.1016/j.jpsychires.2015.02.010,https://linkinghub.elsevier.com/retrieve/pii/S0022395615000424,"Depression and inﬂammatory markers have a reliable cross-sectional association although less is known about the prospective relationship. The current study investigated whether pro-inﬂammatory markers are prospectively associated with depression, and whether indicators of unhealthy lifestyle, physical health and psychosocial functioning may drive this association. Participants were drawn from the Hunter Community Study, a community-dwelling cohort of individuals aged 55e85 years (N ¼ 1410). Participants completed baseline physiological assessment, health-related questionnaires, and blood sampling for the analysis of inﬂammatory markers, C-reactive protein (CRP) and interleukin (IL)-6. Participants completed the same depressive symptom questionnaire again after 3.5e5.5 years. Depression outcomes at follow-up were analysed dichotomously using established scale cut-off scores and continuously as a “residual score”, representing the variation in follow-up depressive symptoms not explained by baseline symptoms and age. Analyses were conducted on males and females separately. At baseline, indicators of unhealthy lifestyle, physical health and psychosocial functioning were associated with depressive symptoms and inﬂammatory markers. For males, there were no relationships between inﬂammatory markers and follow-up depression outcomes. In females, IL-6 was signiﬁcantly associated with depression outcomes in univariate, but not multivariate analyses. However, IL-6 signiﬁcantly mediated the association between the predictors of waist-to-hip ratio, smoking and psychological coping at baseline, and follow-up depression outcomes. The results support the inﬂammatory hypothesis of depression, although females may be more vulnerable to effects. The ﬁndings raise the possibility that unhealthy lifestyle and psychosocial stress may drive inﬂammation and subsequent depressive symptoms.",2015-04,65-74,,,63,,,en,,4/1/2015,
339,includedItem,journalArticle,2015,"Firth, J.;Cotter, J.;Elliott, R.;French, P.;Yung, A. R.",A systematic review and meta-analysis of exercise interventions in schizophrenia patients,Psychological Medicine,1469-8978,10.1017/S0033291714003110,,"BACKGROUND: The typically poor outcomes of schizophrenia could be improved through interventions that reduce cardiometabolic risk, negative symptoms and cognitive deficits; aspects of the illness which often go untreated. The present review and meta-analysis aimed to establish the effectiveness of exercise for improving both physical and mental health outcomes in schizophrenia patients. METHOD: We conducted a systematic literature search to identify all studies that examined the physical or mental effects of exercise interventions in non-affective psychotic disorders. Of 1581 references, 20 eligible studies were identified. Data on study design, sample characteristics, outcomes and feasibility were extracted from all studies and systematically reviewed. Meta-analyses were also conducted on the physical and mental health outcomes of randomized controlled trials. RESULTS: Exercise interventions had no significant effect on body mass index, but can improve physical fitness and other cardiometabolic risk factors. Psychiatric symptoms were significantly reduced by interventions using around 90 min of moderate-to-vigorous exercise per week (standardized mean difference: 0.72, 95% confidence interval -1.14 to -0.29). This amount of exercise was also reported to significantly improve functioning, co-morbid disorders and neurocognition. CONCLUSIONS: Interventions that implement a sufficient dose of exercise, in supervised or group settings, can be feasible and effective interventions for schizophrenia.",2015-05,1343-1361,,7,45,,,en,,5/1/2015,
340,includedItem,journalArticle,2015,"Mihrshahi, S;Dobson, A J;Mishra, G D",Fruit and vegetable consumption and prevalence and incidence of depressive symptoms in mid-age women: results from the Australian longitudinal study on women’s health,European Journal of Clinical Nutrition,"0954-3007, 1476-5640",10.1038/ejcn.2014.222,http://www.nature.com/articles/ejcn2014222,"BACKGROUND/OBJECTIVES: There is continued interest in the associations between diet and depression and several studies have focused on individual dietary factors or diet patterns to investigate the relationship. We investigated the association between fruit and vegetables and symptoms of depression in the mid-age cohort of the Australian Longitudinal Study on Women’s Health. SUBJECTS/METHODS: A total of 6271 women with a mean age of 55.45 (1.45 s.d.) years were followed up at three surveys over 6 years. A score of ⩾ 10 on the Center for Epidemiological Studies Depression-10 scale indicated depressive symptoms. Fruit and vegetable intake was assessed using short questions. RESULTS: A total of 381 women (6.1%) were depressed at all three surveys over the 6-year survey period. Cross-sectional logistic regression analysis using general estimating equations showed a reduced odds of depressive symptoms (odds ratio (OR) 0.86 (95% conﬁdence interval (CI) 0.79–0.95, P = 0.001)) among women who ate ⩾ 2 of fruit/day even after adjustment for several factors including smoking, alcohol, body mass index, physical activity, marital status, education, energy, ﬁsh intake and comorbidities. The predictive model also showed a reduced odds of depressive symptoms (OR 0.82 (95% CI 0.70–0.96, P = 0.012)) among women who ate ⩾ 2 pieces of fruit/day. There was also an association between vegetable intake and prevalence of depressive symptoms at higher levels of intake. CONCLUSIONS: Increasing fruit consumption may be one important factor for reducing both the prevalence and incidence of depressive symptoms in mid-age women. European Journal of Clinical Nutrition (2015) 69, 585–591; doi:10.1038/ejcn.2014.222; published online 29 October 2014",2015-05,585-591,,5,69,,,en,,5/1/2015,
341,includedItem,journalArticle,2015,"Rosenbaum, Simon;Newby, Jill M.;Steel, Zachary;Andrews, Gavin;Ward, Philip B.",Online physical activity interventions for mental disorders: a systematic review,Internet Interventions,2214-7829,10.1016/j.invent.2015.04.001,http://www.sciencedirect.com/science/article/pii/S2214782915000196,"Background Accumulating evidence indicates that face-to-face physical activity interventions improve the physical and mental health of people with mental disorders. However, it is unclear whether internet-delivered physical activity interventions are also efficacious. Objective Our aim was to determine the effect of online physical activity interventions on the severity of symptoms of mental illness among people experiencing mental disorders. Methods A systematic review of major electronic databases was conducted from inception to January 2015. Randomised controlled trials of internet-delivered interventions to increase physical activity participation in adults (>18years) with a DSM, ICD, clinician-confirmed diagnosis, and/or those receiving specialist mental health treatment were eligible for inclusion. Outcome data for symptom severity (depression) and physical activity participation was extracted. Results Two trials (N=95 participants) met the inclusion criteria, which investigated online clinician-guided interventions of 9–10week duration. Results were discrepant across studies. One study found a moderate between-groups effect size compared to wait-list control on depression outcomes (d=.67) but no differences in physical activity participation. In the other study, there were no significant differences between an online physical activity intervention versus treatment-as-usual in a university counselling service. Conclusion The preliminary findings suggest that online physical activity interventions may have positive effects on depression symptoms, but the size of the effects and mechanism of change remain unclear. Further research is critically needed to explore the efficacy and acceptability of online physical interventions for people with mental disorders.",5/1/2015,214-220,,2,2,,,en,,5/1/2015,
342,includedItem,journalArticle,2015,"Kerling, Arno;Tegtbur, Uwe;Gützlaff, Elke;Kück, Momme;Borchert, Luise;Ates, Zeynep;von Bohlen, Anne;Frieling, Helge;Hüper, Katja;Hartung, Dagmar;Schweiger, Ulrich;Kahl, Kai G.",Effects of adjunctive exercise on physiological and psychological parameters in depression: A randomized pilot trial,Journal of Affective Disorders,0165-0327,10.1016/j.jad.2015.01.006,http://www.sciencedirect.com/science/article/pii/S0165032715000105,"Objective Major depressive disorder (MDD) is associated with decreased physical activity and increased rates of the metabolic syndrome (MetS), a risk factor for the development of type 2 diabetes and cardiovascular disorders. Exercise training has been shown to improve cardiorespiratory fitness and metabolic syndrome factors. Therefore, our study aimed at examining whether patients receiving an exercise program as an adjunct to inpatient treatment will benefit in terms of physiological and psychological factors. Method Fourty-two inpatients with moderate to severe depression were included. Twenty-two patients were randomized to additional 3x weekly exercise training (EXERCISE) and compared to treatment as usual (TAU). Exercise capacity was assessed as peak oxygen uptake (VO2peak), ventilatory anaerobic threshold (VAT) and workload expressed as Watts (W). Metabolic syndrome was defined according to NCEP ATPIII panel criteria. Results After 6 weeks of treatment, cardiorespiratory fitness (VO2peak, VAT, Watt), waist circumference and HDL cholesterol were significantly improved in EXERCISE participants. Treatment response expressed as ≥50% MADRS reduction was more frequent in the EXERCISE group. Conclusions Adjunctive exercise training in depressed inpatients improves physical fitness, MetS factors, and psychological outcome. Given the association of depression with cardiometablic disorders, exercise training is recommended as an adjunct to standard antidepressant treatment.",5/15/2015,6-Jan,,,177,,,en,,5/15/2015,
343,includedItem,journalArticle,2015,"Collard, Rose M;Comijs, Hannie C;Naarding, Paul;Penninx, Brenda W;Milaneschi, Yuri;Ferrucci, Luigi;Oude Voshaar, Richard C",Frailty as a predictor of the incidence and course of depressed mood,Journal of the American Medical Directors Association,1538-9375,10.1016/j.jamda.2015.01.088,,"Background: Late-life depression and physical frailty are supposed to be reciprocally associated, however, longitudinal studies are lacking.; Objectives: This study examines whether physical frailty predicts a higher incidence of depression, as well as a less favorable course of depression.; Methods: A population-based cohort study of 888 people aged 65 years and over with follow-up measures at 3, 6, and 9 years. Cox proportional hazards models adjusted for age, sex, education, smoking, alcohol usage, and global cognitive functioning were applied to calculate the incidence of depressed mood in those nondepressed at baseline (n = 699) and remission in those with depressed mood at baseline (n = 189). Depressed mood onset or remission was defined as crossing the cut-off score of 20 points on the Center for Epidemiological Studies-Depression Scale combined with a relevant change in this score. Physical frailty was based on the presence of ≥ 3 out of 5 components (ie, weight loss, weakness, slowness, exhaustion, and low physical activity level).; Results: A total of 214 out of 699 (30.6%) nondepressed persons developed depressed mood during follow-up. Physical frailty predicted the onset of depressed mood with a hazard rate of 1.26 (95% confidence interval 1.09-1.45, P = .002). Of the 189 persons with depressed mood at baseline, 96 (50.8%) experienced remission during follow-up. Remission was less likely in the presence of a higher level of physical frailty (hazard rate = 0.72, 95% confidence interval 0.58-0.91, P = .005).; Conclusions: Because physical frailty predicts both the onset and course of late-life depressed mood, physical frailty should receive more attention in mental health care planning for older persons as well as its interference with treatment. Future studies into the pathophysiological mechanisms may guide the development of new treatment opportunities for these vulnerable patients. (Copyright © 2015 AMDA - The Society for Post-Acute and Long-Term Care Medicine. Published by Elsevier Inc. All rights reserved.)",6/1/2015,509-514,,6,16,,,,,6/1/2015,
